{
  "vislang": "0.1",
  "id": "example",
  "name": "Example",
  "version": "0.1.0",
  "status": "draft",
  "binds": {
    "tokens": { "format": "none" },
    "roles": [
      { "role": "action.primary", "required": true, "fallback": "#000000" }
    ]
  },
  "invariants": [
    {
      "id": "INV-PRIMARY-01",
      "statement": "One primary action role is bound.",
      "severity": "error",
      "applies_to": [{}],
      "predicate": { "kind": "single_primary_action_role", "role": "action.primary" }
    }
  ]
}
